<?xml version="1.0" encoding="UTF-8"?>
<tariffs xmlns:xsi="http://www.w3.org/2001/XMLSchema-instance"
         xmlns="http://www.example.org/tariffs"
         xsi:schemaLocation="http://www.example.org/tariffs/resources/schema.xsd">

    <constant-tariff number="">
        <name></name>
        <tariffID>
            <call-prices>0</call-prices>
            <sms-price>10</sms-price>
        </tariffID>
        <operator-name>A1</operator-name>
        <payroll> </payroll>
        <parameters></parameters>
        <constant-tariff-type> </constant-tariff-type>
        <constant-tariff-parameters> </constant-tariff-parameters>
    </constant-tariff>